,ID,NAZWASEKCJI,WARTOSC,DATA_WPLYWU,WI_KONKURS_ID,TYTUL,SLOWA_KLUCZE,WI_STATUSWNIOSKU_KOD
39,2195,opisProjektuCelNaukowy,"<p align=""justify"">W projekcie badawczym nr 0T00A 016 23 pt. &bdquo;Pomiar i badanie cech osobniczych sygnał&oacute;w szumowych powodowanych przez płetwonurk&oacute;w&rdquo; w eksperymentach pomiarowych zgromadzono zbi&oacute;r sygnał&oacute;w szumowych na podstawie, kt&oacute;rego przeprowadzono badania identyfikacyjne przebieg&oacute;w reprezentatywnych dla aktywności płetwonurka w środowisku podwodnym. Wykazano, że zastosowanie statystyk wyższych rzęd&oacute;w w połączeniu z analizą falkową sygnał&oacute;w szumowych jest skutecznym narzędziem do wykrywania oraz identyfikacji przebieg&oacute;w reprezentatywnych dla aktywności płetwonurka w środowisku podwodnym. <br />Projekt jest kontynuacją podjętej tematyki, a jego podstawowym celem jest opracowanie algorytm&oacute;w detekcji i identyfikacji rozważanej klasy sygnał&oacute;w oraz ich implementacja w strukturze procesora sygnałowego. <br />Problemem naukowym w projekcie jest opracowanie algorytm&oacute;w detekcji zaburzeń w środowisku podwodnym oraz ich identyfikacji w warunkach, gdy przyjęcie założeń o gaussowskim charakterze zakł&oacute;ceń w środowisku pomiarowym nie jest możliwe. Cechy osobnicze środowiska pomiarowego (zmienny stan, aktywność przypadkowych źr&oacute;deł dźwięk&oacute;w, itp.) powodują, że rozwiązanie problemu wykrywania zaburzeń powodowanych przez aparat wspomagający oddychanie płetwonurka, wymaga łącznego ujęcia zagadnienia detekcji i identyfikacji sygnał&oacute;w pomiarowych. <br />Końcowym wynikiem projektu będzie opracowany na bazie procesora sygnałowego model laboratoryjny specjalizowanego modułu z interfejsami do akwizycji sygnał&oacute;w pomiarowych oraz komunikacji z układami zobrazowania stan&oacute;w aktywności płetwonurka w środowisku podwodnym. <br /><br /></p>",06/08/23,1,System akustycznego wykrywania płetwonurków w środowisku podwodnym,"szumy podwodne, identyfikacja",173
40,2215,opisProjektuCelNaukowy,"&nbsp;
<div>W ostatnich kilkunastu latach jednym z gł&oacute;wnych wymagań stawianych układom sterowania precyzyjnego na okrętach trałujących tory wodne jest jest zdolność do dokładnego przemieszczenia się wzdłuż zadanych trajektorii ruchu oraz sprawnego i dokładnego zbliżania się do zadanego punktu np. podczas sterowania pojazdem podwodnym.</div>
<div>Celem projektu jest opracowanie układu sterowania okrętu zwalczania min, zawierające analizę liniowych i nieliniowych modeli matematycznych okrętu wyposażonego w nowoczesne układy napędowe z uwzględnieniem zakł&oacute;ceń, charakterystyki oporowe pływania swobodnego i bocznego jednostki zwalczania min, opis matematyczny rozpatrywanych układ&oacute;w napędowych przydatny dla cel&oacute;w sterowania, identyfikację własności dynamicznych okrętu jako wielowymiarowego obiektu sterowania oraz syntezę algorytmu sterowania okrętem z wykorzystaniem sztucznej inteligencji podczas wykonywania zadań poszukiwania i zwalczania min. Algorytm sterowania okrętem zostanie poddany badaniom symulacyjnym w warunkach laboratoryjnych i zweryfikowany na okręcie w rzeczywistych warunkach morskich. Przeprowadzona będzie też analiza wrażliwości sterowania na zmianę parametr&oacute;w eksploatacyjnych dynamiki okrętu, niedokładności pomiaru zmiennych stanu procesu i wpływu zakł&oacute;ceń. </div>
<div>Problem zapewnienia właściwej sterowności jednostce pływającej wykorzystującej nowoczesne niekonwencjonalne układy napędowe jest zagadnieniem złożonym i w chwili obecnej nie ma układu sterowania zapewniającego w pełni zautomatyzowane utrzymywanie okrętu z zadowalającą dokładnością podczas wykonywania zadań sterowania precyzyjnego. Będący celem projektu, oparty o sztuczną inteligencję, układ sterowania zapewni jednostce zwalczania min działanie z dużą dokładnością i wykorzystywać będzie zespoły napędowe generujące minimalne pola fizyczne. </div>
W chwili obecnej, w praktyce sterowanie sprowadza się do układu otwartego, kt&oacute;rego końcowy efekt zależy w gł&oacute;wnej mierze od doświadczenia i wiedzy teoretycznej oficera wachtowego oraz umiejętności sternika. Stąd wynika duże zainteresowanie zał&oacute;g okręt&oacute;w rozwiązaniem tego problemu przez dedykowany inteligentny układ automatycznego sterowania.",06/08/22,1,Sterowanie precyzyjne okrętem przy małych prędkościach ruchu z wykorzystaniem metod sztucznej inteligencji,"Sterowanie precyzyjne, Poszukiwanie min, Regulator, Sztuczna inteligencja",183
41,2255,opisProjektuCelNaukowy,"<font face=""Arial"" size=""3"">
<p>Celem naukowym projektu jest analiza moż</p>
</font><font face=""Arial"" size=""3"">liwo</font><font face=""Arial"" size=""3"">ś</font><font face=""Arial"" size=""3"">ci detekcji ruchomego obiektu podwodnego przez wykrywanie wywo</font><font face=""Arial"" size=""3"">ł</font><font face=""Arial"" size=""3"">anych jego ruchem zmian w </font><font face=""Arial"" size=""3"">ś</font><font face=""Arial"" size=""3"">rodowisku wodnym oraz skonstruowanie i przebadanie w warunkach laboratoryjnych i rzeczywistych demonstrarota technolog! urz</font><font face=""Arial"" size=""3"">ą</font><font face=""Arial"" size=""3"">dzenia realizuj</font><font face=""Arial"" size=""3"">ą</font><font face=""Arial"" size=""3"">cego powy</font><font face=""Arial"" size=""3"">ż</font><font face=""Arial"" size=""3"">sze zadanie.</font><font face=""Arial"" size=""3"">
<p>Doś</p>
</font><font face=""Arial"" size=""3"">wiadczenie autor</font><font face=""Arial"" size=""3"">&oacute;</font><font face=""Arial"" size=""3"">w projektu, zdobyte przy konstruowaniu i uruchamianiu urz</font><font face=""Arial"" size=""3"">ą</font><font face=""Arial"" size=""3"">dze</font><font face=""Arial"" size=""3"">ń </font><font face=""Arial"" size=""3"">optycznych i elektronicznych, bogato wyposa</font><font face=""Arial"" size=""3"">ż</font><font face=""Arial"" size=""3"">one laboratorium oraz gotowo</font><font face=""Arial"" size=""3"">ść</font><font face=""Arial"" size=""3""> do wsp</font><font face=""Arial"" size=""3"">&oacute;ł</font><font face=""Arial"" size=""3"">pracy ze strony instytucji Marynarki Wojennej RP pozwoli na szybk</font><font face=""Arial"" size=""3"">ą</font><font face=""Arial"" size=""3""> realizacj</font><font face=""Arial"" size=""3"">ę</font><font face=""Arial"" size=""3""> zadania oraz sprawne przeprowadzenie eksperymentu z wykorzystaniem jednostek p</font><font face=""Arial"" size=""3"">ł</font><font face=""Arial"" size=""3"">ywaj</font><font face=""Arial"" size=""3"">ą</font><font face=""Arial"" size=""3"">cych.</font>",06/08/23,1,URZĄDZENIE DO OPTYCZNEGO WYKRYWANIA PŁYWAJĄCYCH OBIEKTW PODWODNYCH,"lasery, elektronika, detekcja",173
42,2256,opisProjektuCelNaukowy,"&nbsp;
<div align=""justify"">Zdecydowana większość stosowanych pocisk&oacute;w kumulacyjnych wyposażona jest we wkładki stożkowe, jednak obecnie istnieje tendencja do stosowania w ładunkach kumulacyjnych (pociski granatnikowe, artyleryjskie i ppk, miny, granaty, ładunki g&oacute;rnicze do poszukiwań ropy naftowej) wkładek o bardziej wysublimowanych kształtach, tj. trąbkowych, dzwonowych, itp. Celem projektu jest określenie możliwości zwiększenia zdolności przebicia pancerzy RHA poprzez modyfikację kształtu wkładki kumulacyjnej.</div>
<div align=""justify"">Cel ten zamierza się osiągnąć za pomocą teoretycznego opracowania formowania strumieni kumulacyjnych z wkładek trąbkowych i dzwonowych głowic kumulacyjnych z zastosowaniem symulacji komputerowych oraz doświadczalnego sprawdzenia konstrukcji i technologii wykonania element&oacute;w głowicy kumulacyjnej.</div>
<div align=""justify"">Efektem projektu będą modele głowic o zwiększonej zdolności przebicia, kt&oacute;re będzie można zastosować w amunicji granatnikowej, a także w amunicji artyleryjskiej i ppk. Zbadanie charakteru generowania i propagacji strumienia kumulacyjnego z wkładek o kształtach trąbkowych i dzwonowych może także pozwolić na zastosowanie tego typu wkładek w minach a także w przemyśle np. g&oacute;rnictwie naftowym.</div>",06/08/31,1,Badania możliwości zwiększenia głębokości przebicia pancerza strumieniem granatnikowej głowicy kumulacyjnej poprzez optymalizację kształtu jej wkładki,"kumulacja, głowica kumulacyjna, pocisk kumulacyjny, wkładka kumulacyjna",183
43,2275,opisProjektuCelNaukowy,"<p class=""bezAkapitu"" style=""MARGIN: 0cm 0cm 0pt; TEXT-INDENT: 35.4pt; LINE-HEIGHT: 150%""><font size=""3""><span style=""COLOR: black; LINE-HEIGHT: 150%; FONT-FAMILY: &quot;Times New Roman&quot;; mso-bidi-font-size: 12.0pt"">Przeciwlotniczy zestaw rakietowy (PZR) Newa SC przystosowany jest do wsp&oacute;łpracy z nowoczesnymi &ndash; cyfrowymi systemami przekazywania danych o sytuacji radiolokacyjnej. Jednym z takich system&oacute;w jest własna stacja radiolokacyjna wstępnego wykrywania (RSWW). </span><span style=""LINE-HEIGHT: 150%; FONT-FAMILY: &quot;Times New Roman&quot;; mso-bidi-font-size: 12.0pt"">Dzięki temu praca stacji naprowadzania rakiet (SNR) może być uniezależniona od informacji radiolokacyjnej z innych zewnętrznych źr&oacute;deł. Jednak wysoka cena takich system&oacute;w radiolokacyjnych i szczupły budżet MON na zakup nowego sprzętu powoduje, że SNR są niejednokrotnie pozbawione niezbędnej informacji radiolokacyjnej, a ich walory bojowe są ograniczone. W Wojskach Rakietowych Sił Powietrznych przystosowano funkcjonujące analogowe stacje radiolokacyjne P-18 &bdquo;LAURA&rdquo; do wsp&oacute;łpracy z SNR NEWA SC. Ograniczeniem stosowanego rozwiązania jest: zakres przetwarzanej odległości do 100km, możliwość wsp&oacute;łpracy tyko z jedną SNR, przekazywanie wykryć w postaci plot&oacute;w.<o:p></o:p></span></font></p>
<p class=""MsoBodyText"" style=""MARGIN: 0cm 0cm 0pt; TEXT-INDENT: 1cm; LINE-HEIGHT: 150%; TEXT-ALIGN: justify""><span style=""LINE-HEIGHT: 150%; FONT-FAMILY: &quot;Times New Roman&quot;; mso-bidi-font-size: 12.0pt""><font size=""3"">Celem niniejszego projektu jest opracowanie cyfrowego interfejsu wydawania informacji radiolokacyjnej o sytuacji powietrznej z radiolokacyjnej stacji wstępnego wykrywania P-18, kt&oacute;ry eliminuje wady dotychczas stosowanego rozwiązania:<o:p></o:p></font></span></p>
<p class=""MsoBodyText"" style=""MARGIN: 0cm 0cm 0pt 45pt; TEXT-INDENT: -18pt; LINE-HEIGHT: 150%; TEXT-ALIGN: justify; mso-list: l0 level1 lfo1; tab-stops: list 45.0pt 64.35pt""><span style=""LINE-HEIGHT: 150%; FONT-FAMILY: &quot;Times New Roman&quot;; mso-bidi-font-size: 12.0pt""><span style=""mso-list: Ignore""><font size=""3"">1.</font><span style=""FONT: 7pt &quot;Times New Roman&quot;"">&nbsp;&nbsp;&nbsp;&nbsp;&nbsp; </span></span></span><span style=""LINE-HEIGHT: 150%; FONT-FAMILY: &quot;Times New Roman&quot;; mso-bidi-font-size: 12.0pt""><font size=""3"">Zakres przetwarzanej odległości &ndash; maksymalny zasięg stacji;<o:p></o:p></font></span></p>
<p class=""MsoBodyText"" style=""MARGIN: 0cm 0cm 0pt 45pt; TEXT-INDENT: -18pt; LINE-HEIGHT: 150%; TEXT-ALIGN: justify; mso-list: l0 level1 lfo1; tab-stops: list 45.0pt 64.35pt""><span style=""LINE-HEIGHT: 150%; FONT-FAMILY: &quot;Times New Roman&quot;; mso-bidi-font-size: 12.0pt""><span style=""mso-list: Ignore""><font size=""3"">2.</font><span style=""FONT: 7pt &quot;Times New Roman&quot;"">&nbsp;&nbsp;&nbsp;&nbsp;&nbsp; </span></span></span><span style=""LINE-HEIGHT: 150%; FONT-FAMILY: &quot;Times New Roman&quot;; mso-bidi-font-size: 12.0pt""><font size=""3"">Możliwość sterowania pracą RSWW z SNR (włączenie/wyłączenie &bdquo;wysokiego&rdquo;, sterowanie obrotami anteny); <o:p></o:p></font></span></p>
<p class=""MsoBodyText"" style=""MARGIN: 0cm 0cm 0pt 45pt; TEXT-INDENT: -18pt; LINE-HEIGHT: 150%; TEXT-ALIGN: justify; mso-list: l0 level1 lfo1; tab-stops: list 45.0pt 64.35pt""><span style=""LINE-HEIGHT: 150%; FONT-FAMILY: &quot;Times New Roman&quot;; mso-bidi-font-size: 12.0pt""><span style=""mso-list: Ignore""><font size=""3"">3.</font><span style=""FONT: 7pt &quot;Times New Roman&quot;"">&nbsp;&nbsp;&nbsp;&nbsp;&nbsp; </span></span></span><span style=""LINE-HEIGHT: 150%; FONT-FAMILY: &quot;Times New Roman&quot;; mso-bidi-font-size: 12.0pt""><font size=""3"">Możliwość odsunięcia RSWW od SNR na dużą odległość (nawet kilkadziesiąt km);<o:p></o:p></font></span></p>
<p class=""MsoBodyText"" style=""MARGIN: 0cm 0cm 0pt 45pt; TEXT-INDENT: -18pt; LINE-HEIGHT: 150%; TEXT-ALIGN: justify; mso-list: l0 level1 lfo1; tab-stops: lis...",06/08/24,1,"Opracowanie cyfrowego interfejsu wydawania informacji o sytuacji powietrznej z radiolokacyjnej stacji wstępnego wykrywania P-18, dla potrzeb Wojsk Rakietowych Sił powietrznych RP","stacja radiolokacyjna, przeciwlotniczy zestaw rakietowy",173
44,2276,opisProjektuCelNaukowy,"Do zwalczania środk&oacute;w napadu powietrznego stosowane są często pociski artyleryjskie. Ruchowi pocisku artyleryjskiego towarzyszy szereg zjawisk fizycznych, kt&oacute;re mogą być wykorzystane jako źr&oacute;dło informacji, dając możliwość określenia jego położenia w przestrzeni, na podstawie zebranych sygnał&oacute;w z rozlokowanych czujnik&oacute;w pomiarowych. Istotą projektu jest opracowanie pasywnej metody określania odległości przelotu pocisku artyleryjskiego względem ruchomej tarczy powietrznej, wykorzystującej zaburzenia ośrodka wywołane ruchem pocisku. Tarcza powietrzna jest to ostrzeliwany, ruchomy cel powietrzny, wyposażony w aparaturę pomiarową, określającą zmiany wybranych wielkości zaburzeń ośrodka. Tarcza powietrzna drogą radiową przesyła dane do jednostki naziemnej, gdzie są rejestrowane i przetwarzane. <br />Jako nośnik informacji pierwotnej o parametrach ruchu pocisku artyleryjskiego, przemieszczającego się z prędkościami naddźwiękowymi, wykorzystane zostaną fale ciśnieniowe wzbudzane w powietrzu przez poruszający się pocisk. <br />Rozważania te wynikają z następujących przesłanek: <br /> ruchowi pocisku towarzyszy zaburzenie ośrodka w kt&oacute;rym się porusza; <br /> fala wywołana ruchem pocisku w środowisku sprężystym może być wykorzystana jako źr&oacute;dło informacji o położeniu pocisku względem celu; <br /> wykorzystując czujniki pomiarowe, przy znanym ich położeniu względem siebie, można opracować algorytm określania tor lotu pocisku względem celu; <br /> z uwagi na względnie wolne zmiany parametr&oacute;w ośrodka lotu pocisku strumień danych pomiarowych z poszczeg&oacute;lnych czujnik&oacute;w może być przesyłany, w czasie rzeczywistym, łączem radiowym o stosunkowo małej przepustowości, a tym samym tanim; <br /> zastosowanie czujnik&oacute;w o małych gabarytach nie powinno zakł&oacute;cać lotu ruchomej tarczy powietrznej. <br /><br />W wyniku analiz, badań eksperymentalnych i symulacyjnych sformułowane zostaną podstawy teoretyczne metody pasywnego określania odległości przelotu pocisku artyleryjskiego względem ruchomej tarczy powietrznej. Aby z kolei zweryfikować możliwości metody opracowane zostaną układy, algorytmy, aplikacje programowe oraz przeprowadzone badania modelu wielokanałowego lokatora pasywnego. Zaproponowana w projekcie struktura funkcjonalno-techniczna systemu określania odległości przelotu oraz wykorzystanie w jego warstwie pomiarowej zjawisk dźwiękowych uwarunkowane są minimalizacją koszt&oacute;w, w szczeg&oacute;lności ruchomej tarczy powietrznej. <br />",06/07/31,1,Analiza możliwości określania przelotu pocisku względem ruchomej tarczy powietrznej,"lokacja obiektów, drgania ośrodka, fala dźwiękowa",183
45,2286,opisProjektuCelNaukowy,"<p class=""MsoNormal"" style=""MARGIN: 0cm 0cm 0pt; TEXT-INDENT: 17.85pt; TEXT-ALIGN: justify""><font face=""Times New Roman"" size=""3"">Jedną z najważniejszych charakterystyk przeciwlotniczych zestaw&oacute;w rakietowych są stosowane w nim metody naprowadzania rakiet na cele powietrzne. Nadrzędnym wymaganiem przy wyborze metody jest, aby rakieta została naprowadzona w rejon celu z błędem nie większym od promienia skutecznego działania głowicy bojowej. Dla tak sformułowanego warunku nie istnieje jednoznaczne rozwiązanie tego zadania, i trajektorii, kt&oacute;re spełniają powyższe wymaganie, jest nieskończenie wiele. Dlatego też niezbędne jest sprecyzowanie dodatkowych ograniczeń i kryteri&oacute;w umożliwiających ilościowe por&oacute;wnywanie własności przyjętych sposob&oacute;w naprowadzania. Przy ich formułowaniu należy uwzględnić czynniki takie jak: możliwości manewrowe rakiet w odniesieniu do zdolności manewrowych wsp&oacute;łczesnych środk&oacute;w napadu powietrznego, możliwości i jakość pomiaru parametr&oacute;w ruchu celu i rakiety (wymaganych przez metodę), wpływ zakł&oacute;ceń na proces sterowania rakietą, własności dynamiczne obwodu naprowadzania oraz promień skutecznego działania głowicy bojowej. Z drugiej strony ich uwzględnienie powoduje, że wyznaczenie metody naprowadzania staje się zadaniem bardzo złożonym, a uzyskane formalne rozwiązania wymagają zastosowania bardzo skomplikowanej funkcjonalnie i technicznie aparatury. Wynika to z faktu, że metoda naprowadzania w znacznym stopniu determinuje strukturę funkcjonalną zestawu rakietowego, w szczeg&oacute;lności układ&oacute;w określania wsp&oacute;łrzędnych ruchu celu i rakiet (na og&oacute;ł radiolokacyjnych) oraz układ&oacute;w wyliczania komend naprowadzania. Z tych powod&oacute;w dotychczas stosowane w zestawach rakietowych metody naprowadzania wywodzą się z model&oacute;w idealizujących zjawiska towarzyszące naprowadzaniu rakiety na cel przy jednoczesnym zawężeniu kryteri&oacute;w jakości naprowadzania. Charakterystycznym tego przykładem jest synteza metod naprowadzania przy traktowaniu obwodu naprowadzania w kategoriach kinematycznych. Dorobek teorii naprowadzania rakiet prowadzi do konkluzji, że możliwości dalszego doskonalenia kinematycznych metod naprowadzania zostały wyczerpane. Wyznaczone z przesłanek kinematycznych metody naprowadzania zapewniają wysoką skuteczność naprowadzania rakiet w rejon celu, ale okupione jest to znacznymi stratami energetycznymi wynikającymi z gwałtownych manewr&oacute;w rakiety na znacznym odcinku jej lotu, r&oacute;wnież przy dużych odległościach od celu. Konsekwencją silnych manewr&oacute;w jest znaczący spadek prędkości rakiety, a tym samym spadek zdolności manewrowych rakiety (uwarunkowanych spadkiem oddziaływań aerodynamicznych) oraz ograniczenie zasięgu lotu rakiety. </font></p>
<p class=""MsoBodyText"" style=""MARGIN: 0cm 0cm 0pt; TEXT-INDENT: 26.95pt; TEXT-ALIGN: justify""><span style=""FONT-FAMILY: &quot;Times New Roman&quot;""><font size=""3"">Z powyższych powod&oacute;w podjęcie badań teoretycznych w zakresie nowych metod naprowadzania ma znaczenie nie tylko dla rozwoju teorii naprowadzania rakiet, ale r&oacute;wnież uwarunkowane jest możliwościami i potrzebami praktycznymi. Dorobek og&oacute;lnej teorii sterowania obiektami i ich obserwacji w warunkach silnego oddziaływania zakł&oacute;ceń oraz dostępność wysokowydajnych środk&oacute;w obliczeniowych, pozwalających na realizację złożonych obliczeń w czasie rzeczywistym, uzasadniają teoretyczny i praktyczny sens podjęcia badań w zakresie poszukiwania nowych metod naprowadzania rakiet na cel.<o:p></o:p></font></span></p>
<p class=""MsoNormal"" style=""MARGIN: 0cm 0cm 0pt; TEXT-ALIGN: justify""><span style=""mso-bidi-font-family: Arial""><font size=""3""><font face=""Times New Roman""><span style=""mso-tab-count: 1"">&nbsp;&nbsp;&nbsp;&nbsp;&nbsp;&nbsp;&nbsp;&nbsp;&nbsp;&nbsp;&nbsp; </span>Uzyskane wyniki badań zostaną wykorzystane do syntezy nowej metody naprowadzania oraz posłużą do opraco...",06/08/24,1,Analiza możliwości zwiększania zasięgu rakiety przeciwlotniczej poprzez zmianę algorytmu naprowadzania,"przeciwlotnicze zestawy rakietowe, metody naprowadzania, układy wyliczania komend",173
46,2296,opisProjektuCelNaukowy,"<p class=""bezAkapitu"" style=""MARGIN: 0cm 0cm 0pt; TEXT-INDENT: 35.4pt; LINE-HEIGHT: 150%""><font face=""Times New Roman""><font size=""3""><span style=""mso-tab-count: 1"">&nbsp;&nbsp;&nbsp;&nbsp;&nbsp;&nbsp;&nbsp;&nbsp;&nbsp;&nbsp;&nbsp; </span><span style=""COLOR: black; FONT-FAMILY: &quot;Times New Roman&quot;"">Przeciwlotniczy zestaw rakietowy (PZR) Newa SC oraz inne tego typu zestawy podczas treningu oraz pracy bojowej poddawany jest wnikliwej ocenie parametr&oacute;w technicznych. Wnikliwie oceniane są r&oacute;wnież umiejętności obsług bojowych, ich wyszkolenie manualne oraz wiedzę techniczną niezbędną do podejmowania decyzji podczas realnych działań. Bieżąca sytuacja radiolokacyjna, jakość sprzętu oraz podejmowane decyzje obsług zobrazowane są na wskaźnikach </span></font></font><span style=""FONT-FAMILY: &quot;Times New Roman&quot;""><font size=""3"">stacji naprowadzania rakiet NEWA S.C..<span style=""COLOR: black""><o:p></o:p></span></font></span></p>
<p class=""bezAkapitu"" style=""MARGIN: 0cm 0cm 0pt; TEXT-INDENT: 35.4pt; LINE-HEIGHT: 150%""><font size=""3""><span style=""COLOR: black; FONT-FAMILY: &quot;Times New Roman&quot;"">R&oacute;wnoczesna rejestracja </span><span style=""FONT-FAMILY: &quot;Times New Roman&quot;"">sygnał&oacute;w zobrazowanych na wskaźnikach stacji naprowadzania rakiet oraz dodatkowych informacji /fonia, sygnały binarne i analogowe/ pozwoliłaby na pełną i wiarygodną ocenę procesu naprowadzania rakiet. <span style=""mso-spacerun: yes"">&nbsp;</span>Taka obiektywna ocena byłaby podstawą do weryfikacji nieszczęśliwych wypadk&oacute;w podczas procesu naprowadzania rakiet.<o:p></o:p></span></font></p>
<p class=""bezAkapitu"" style=""MARGIN: 0cm 0cm 0pt; TEXT-INDENT: 35.4pt; LINE-HEIGHT: 150%""><span style=""FONT-FAMILY: &quot;Times New Roman&quot;""><o:p><font size=""3"">&nbsp;</font></o:p></span></p>
<p class=""MsoBodyText"" style=""MARGIN: 0cm 0cm 0pt; TEXT-INDENT: 1cm; LINE-HEIGHT: 150%; TEXT-ALIGN: justify""><span style=""FONT-FAMILY: &quot;Times New Roman&quot;""><font size=""3"">Celem niniejszego projektu jest opracowanie metod i algorytm&oacute;w filtracji i kompresji sygnał&oacute;w VIDEO do potrzeb rejestracji, oraz opracowanie układu automatycznej rejestracji sygnał&oacute;w i informacji zobrazowanych na wskaźnikach stacji naprowadzania rakiet NEWA S.C.. <span style=""mso-spacerun: yes"">&nbsp;</span>Wykonanie i uruchomienie tego układu, oraz przebadanie go w warunkach laboratoryjnych i poligonowych.<o:p></o:p></font></span></p>",06/08/24,1,Opracowanie urządzenia automatycznej rejestracji sygnałów i informacji zobrazowanych na wskaźnikach stacji naprowadzania rakiet NEWA S.C.,"stacja radiolokacyjna, przeciwlotniczy zestaw rakietowy",173
